{
  "requestVersion": "0.1",
  "package": {
    "id": "https://example.org/standards/demo/packages/0.1.0",
    "version": "0.1.0",
    "digest": "sha256:dbcd7acb6a25160cef71ca8ed9dfe6db5c1e455eaa00d297beaccba8a647ae0c"
  },
  "reasoningProfile": {
    "id": "https://example.org/standard/NoEntailmentProfile",
    "version": "0.1.0"
  },
  "checks": [
    "syntax",
    "package-structure",
    "shacl",
    "reasoning-profile",
    "semantic-applicability",
    "test-vectors"
  ],
  "evidence": [
    {
      "path": "data-valid.ttl",
      "digest": "sha256:0ec5dc6467ca0088cad5f647e5b35ba0cac55d9a01ab43263671becd267ddb2f"
    }
  ],
  "requirements": [
    "https://example.org/standard/ProjectTitleRequirement"
  ]
}
